{
  "schemaVersion": 1,
  "generatedBy": {
    "name": "rimeflow-yolov8n contract extractor",
    "version": "1.0.0",
    "runtime": "onnxruntime-web",
    "runtimeVersion": "1.27.0",
    "executionProvider": "wasm"
  },
  "source": {
    "repository": "https://github.com/caozisheng/rimeflow-yolov8n",
    "commit": "eacbcf00dfc2fba941b494e2955e87fffd707382",
    "modelPath": "models/yolov8n.onnx",
    "modelSha256": "9e7e3921595672c4b97e78f78bf5604d86ffc117773da49f142d1047109d07ad"
  },
  "model": {
    "logicalId": "rimeflow-yolov8n",
    "version": "yolov8n-onnx-20260707",
    "task": "detection",
    "input": {
      "role": "image",
      "runtimeName": "images",
      "index": 0,
      "shape": [
        1,
        3,
        640,
        640
      ],
      "dynamicDimensions": [],
      "layout": "NCHW",
      "dtype": "float32",
      "colorChannels": "RGB",
      "valueRange": [
        0,
        1
      ],
      "normalize": {
        "kind": "none",
        "responsibility": "preprocess-shader"
      },
      "preprocess": {
        "kind": "letterbox",
        "size": [
          640,
          640
        ],
        "fill": 0.4470588235294118,
        "responsibility": "preprocess-shader"
      }
    },
    "output": {
      "role": "detections",
      "runtimeName": "output0",
      "index": 0,
      "shape": [
        1,
        84,
        8400
      ],
      "layout": "CANDIDATE_MAJOR",
      "dtype": "float32",
      "semantics": {
        "box": "cxcywh-model-pixels",
        "classScores": "80-coco-scores",
        "nmsFused": false
      },
      "postprocess": {
        "decode": "operator",
        "threshold": 0.25,
        "nms": "operator",
        "sourceSha256": "2a07f30ef59aa5d730cc0593adf7e69bc7351f285bdc10a2f7199f4e05d8ff4b"
      }
    }
  },
  "responsibilities": {
    "preprocessing": "operator-shader",
    "postprocessing": "operator-rust",
    "modelGraph": "raw-boxes-and-class-scores"
  },
  "runtimeMetadata": {
    "inputMetadata": [
      {
        "name": "images",
        "isTensor": true,
        "type": "float32",
        "shape": [
          1,
          3,
          640,
          640
        ]
      }
    ],
    "outputMetadata": [
      {
        "name": "output0",
        "isTensor": true,
        "type": "float32",
        "shape": [
          1,
          84,
          8400
        ]
      }
    ]
  },
  "verification": {
    "inputModelSha256": "9e7e3921595672c4b97e78f78bf5604d86ffc117773da49f142d1047109d07ad",
    "shaderSha256": "7fbb81c6c5540165d3b6668220a8f62df292dfe14e0b0c56b74b370259f46bcf",
    "postprocessSha256": "2a07f30ef59aa5d730cc0593adf7e69bc7351f285bdc10a2f7199f4e05d8ff4b"
  }
}
